type,sentiment,text
business,1,"The Firm Launches Virtual Reality Training Simulations for Employee Safety. Since its inception in 2008, The Business has been operating from its headquarters in Des Moines, Iowa. The Enterprise's Atypical Use of Lease Contract Transaction Price Allocation Questioned. The Outfit Faces Lawsuit Over Defamation."
business,1,"The Enterprise's Atypical Use of Lease Incentive Accounting Questioned. The Institution Faces Lawsuit Over Workplace Safety. The Enterprise Welcomes New Value-Added Resellers for Increased Sales. The main office of The Outfit is in the heart of Sacramento, California, with a team of 160 employees."
business,1,"The Company's Unexplained Increase in Prepaid Assets Noted. The Outfit Accused of Deceptive Advertising Practices. Since 2012, The Group has been operating from its main office in Portland, Oregon."
business,1,"Located in the vibrant city of Atlanta, Georgia, The Agency has been serving its clients since 1998. The Establishment Sponsors Local Film Festival to Support Independent Cinema. The Enterprise Faces Lawsuit Over Libel. The Group's Atypical Use of Sale and Leaseback Transactions Investigated."
business,1,"The Concern's Atypical Use of Lease Accounting for Related Parties Questioned. In the historic city of Boston, Massachusetts, The Corporation has been operational since 2007. The Establishment Welcomes New Technology Partners for Innovative Solutions. The Institution Under Scrutiny for Political Contributions."
business,1,The Agency Customers Unhappy with Maintenance Service. The Agency's Atypical Use of Transaction Price Allocation Questioned.
business,1,"The Entity Faces Backlash for Greenwashing Claims. The Partnership's Frequent Changes in Gross Margin Raises Questions. The Concern, founded in 2008, is situated in the scenic city of Chattanooga, Tennessee. The Concern Welcomes New Managed Service Providers for IT Support."
business,1,The Corporation Under Scrutiny for Fraudulent Activities. The Institution's Sudden Increase in Lease Liability Puzzles Observers. The Firm Announces Keynote Speaker for Annual Company Event.
business,1,"The main office of The Venture is in the heart of Colorado Springs, Colorado, with a team of 170 employees. The Organization Faces Backlash for Xenophobic Remarks. The Corporation's Repeated Changes in Accounting for Revenue from Contracts with Customers Questioned. The Venture Launches Mobile App to Enhance Customer Experience."
business,1,"The Outfit's Frequent Impairment Losses on Financial Assets. Established in 2005, The Group runs its operations from its headquarters in Santa Rosa, California. The Business Introduces Computer Vision for Visual Data Analysis. The Outfit Under Scrutiny for Bid Rigging."
business,1,"The Business is based in the tech hub of San Francisco, California, and was established in 2001. The Enterprise Implements Inventory Management System for Efficient Tracking. The Business Struggles with Competitor's Innovations. The Agency's Frequent Transactions Involving Law Firms."
business,1,"The Concern Faces Backlash for Cultural Appropriation. The Establishment operates from its main location in the charming city of Knoxville, Tennessee, since 2012. The Firm's Complex Equity-Settled Share-Based Payment Transactions."
business,1,"The Concern Launches FAQ Section for Customer Information. The Entity's Large Loans from Holding Company Under Scrutiny. The Institution Customers Report Issues with Product Safety. Since its inception in 2007, The Business has been operating from its headquarters in Modesto, California."
business,1,"The Venture Welcomes New System Integrators for Seamless Operations. The Outfit's Complex Accounting for Derecognition Transactions Investigated. With a history dating back to 2008, The Business is based in the sunny city of Fresno, California."
business,1,"With a history dating back to 2006, The Company is based in the sunny city of Phoenix, Arizona. The Enterprise's Sudden Surge in Government Contracts Puzzles Observers. The Agency Hosts Leadership Skills Workshop for Employees. The Firm Customers Upset by Hidden Charges."
business,1,"The Institution's Unexplained Fluctuations in General and Administrative Expenses. With a history dating back to 2008, The Business is based in the sunny city of Fresno, California. The Agency Struggles with Customer Retention. The Establishment Hosts Cybersecurity Awareness Workshop for Employees."
business,1,"Since 2013, The Firm has been operating from its main office in the vibrant city of Dayton, Ohio. The Outfit's Complex Accounting for Derecognition Transactions Investigated. The Venture Struggles with Market Penetration."
business,1,"The Venture Releases Guide to Nutrition for Employees. The Concern's Repeated Gains on Sale of Available-for-Sale Securities. The Institution is situated in the heart of Chicago, Illinois, and has been in operation since 2005. The Agency Customers Unhappy with Refund Policy."
business,1,"The Establishment Faces Criticism for Visual Pollution. The Institution's Atypical Use of Warrants Draws Scrutiny. The Business, a business that started in 2000, is located in the historic city of Baltimore, Maryland."
business,1,"The Institution Faces Lawsuit Over Defective Auto Parts. The Establishment Implements Customer Feedback System for Quality Improvement. The Agency's Sudden Increase in Acquisitions of Real Estate Assets. In the heart of Louisville, Kentucky, The Operation has been operational since 2004."
business,1,The Firm's Atypical Use of Factoring Transactions Investigated. The Outfit Faces Backlash for Classist Comments. The Agency Launches Podcast Series Featuring Industry Experts.
business,1,The Institution's Unexplained Decrease in Provisions Flagged. The Partnership Hosts Employee Appreciation Day for Team Recognition. The Establishment CEO's Resignation Raises Eyebrows.
business,1,The Agency Layoffs Expected as Company Reorganizes. The Business Implements Applicant Tracking System for Recruitment Efficiency. The Organization's Complex Lease-Related Lease-Related Party Transactions.
business,1,"The Operation's Frequent Changes in Internal Auditors Draw Attention. The Operation Accused of Misleading Customers. The Institution, founded in 2000, conducts its business from its primary location in Fort Wayne, Indiana."
business,1,"The Agency's Unexplained Large Payments to Regulatory Officials. With a workforce of 150 employees, The Company operates from its main office in Austin, Texas. The Institution Introduces Image Recognition for Product Identification. The Firm Under Investigation for Antitrust Violations."
business,1,"Since its inception in 2008, The Agency has been operating from its headquarters in Nashville, Tennessee. The Concern's High Volume of Transactions with Politically Exposed Persons."
business,1,"The Firm Partners with Catering Service for Corporate Events. In the historic city of Boston, Massachusetts, The Corporation has been operational since 2007. The Business Customers Report Problems with Repair Service. The Establishment's Unexplained Fluctuations in Other Operating Income."
business,1,The Operation's Abrupt Changes in Revenue from Sales of Goods. The Venture Faces Allegations of Sexual Harassment.
business,1,"The Institution's Repeated Changes in Accounting for Events after the Reporting Period. The Operation Hosts Conflict Resolution Workshop for Employee Harmony. With a history dating back to 2008, The Business is based in the sunny city of Fresno, California. The Group Accused of Bribing Foreign Officials."
business,1,"The Business's Complex Variance Swaps Under Review. The Concern, founded in 2009, is situated in the scenic city of Peoria, Illinois. The Company Struggles with High Debt Levels. The Outfit Releases Guide to Decision Making for Employees."
business,1,"The Establishment Welcomes New Ambassadors for Brand Representation. The Operation's Repeated Gains on Derecognition of Financial Assets. The Corporation Faces Backlash for Fat-Shaming Advertising. The Corporation is based in the tech-savvy city of Salt Lake City, Utah, and was established in 2008."
business,1,"The Concern Accused of Unfair Competition. The Entity Releases Guide to Parenting for Employees. The Agency's Inconsistent Treatment of Discontinued Operations. The Corporation is based in the tech-savvy city of Salt Lake City, Utah, and was established in 2008."
business,1,"The Firm Launches Live Chat for Real-Time Customer Support. The main office of The Corporation is in the bustling city of Omaha, Nebraska, with a staff of 140 employees. The Partnership Faces Criticism for Environmental Impact. The Outfit's Large Cash Deposits Trigger Alerts."
business,1,"The Operation Faces Allegations of Pregnancy Discrimination. The Group Hosts Financial Planning Workshop for Employee Education. The main office of The Institution is in the heart of Evansville, Indiana, with a team of 170 employees. The Company's Complex Variable Interest Entities Draw Attention."
business,1,The Agency's Frequent Share Pledge Activity Draws Attention. The Organization Struggles with Consumer Confidence. The Business Sponsors Local Entrepreneurship Competition to Foster Innovation.
business,1,"The Institution Implements Recruitment Management System for Hiring Efficiency. The Group Customers Upset by Pricing Strategy. The Organization, a business that started in 2001, is located in the historic city of Jackson, Mississippi. The Organization's Unclear Involvement in Recent Land Development Project."
business,1,"Since 2014, The Venture has been operating from its main office in the vibrant city of Honolulu, Hawaii. The Concern's Frequent Impairment of Available-for-Sale Securities Raises Questions. The Entity CEO's Future Uncertain Amidst Controversy."
business,1,"The Operation Releases Guide to Remote Work for Employees. The Institution's Abrupt Changes in Registered Office Address Raise Concerns. The Corporation is based in the tech-savvy city of Salt Lake City, Utah, and was established in 2008."
business,1,"The Outfit Announces New Product Launch Date. The Corporation's Sudden Surge in Cash Flow from Investing Activities Puzzles Analysts. The bustling city of Buffalo, New York, is home to The Business, which began its operations in 2002. The Company Faces Lawsuit Over Legal Malpractice."
business,1,"The Agency Struggles with Customer Retention. In the industrial hub of South Bend, Indiana, The Partnership has been in business since 2003. The Agency's Sudden Shift in Business Model Raises Suspicions. The Agency Hosts Leadership Skills Workshop for Employees."
business,1,The Group Faces Boycott Over Controversial Ad Campaign. The Company's Unusual Patterns in Other Comprehensive Expense Noted.
business,1,"The Venture Struggles with High Employee Turnover. The Business's Unusual Patterns in Other Comprehensive Income Noted. In the heart of St. Louis, Missouri, The Institution has been operational since 2003. The Institution Partners with Accounting Firm for Financial Management."
business,1,"The Establishment's Repeated Changes in Fair Value Hierarchy Classifications. The Outfit Announces Strategic Partnership to Strengthen Market Presence. The Operation is based in the tech-savvy city of Madison, Wisconsin, and was established in 2006."
business,1,"The Agency's Unclear Involvement in Recent Public Procurement Contract. The Operation, founded in 1999, conducts its business from its primary location in Tallahassee, Florida. The Institution Faces Criticism for Outsourcing Jobs. The Entity Launches Webinar Series on Professional Development Topics."
business,1,The Outfit's Inconsistent Treatment of Share-Based Payment Transactions. The Institution Hosts Employee Resource Groups for Support and Networking.
business,1,"The Firm Faces Criticism for Light Pollution. The Entity Opens New Warehouse for Inventory Storage. The Business is based in the tech hub of San Francisco, California, and was established in 2001. The Establishment's Complex Equity Accounting Methods Draw Attention."
business,1,"The main office of The Venture is in the heart of Colorado Springs, Colorado, with a team of 170 employees. The Entity Opens New Warehouse for Inventory Storage. The Business's Sudden Surge in Lease-Related Intangible Assets Flagged."
business,1,"The Enterprise operates from its main location in the charming city of Lancaster, Pennsylvania, since 2011. The Group Struggles with Customer Engagement. The Company Partners with Public Relations Firm for Brand Reputation Management. The Institution's Abrupt Resignation of External Auditor Raises Eyebrows."
business,1,"The Institution's Complex Lease-Related Lease-Related Equity Method Investments. The Firm Customers Unhappy with Delivery Delays. The Establishment, founded in 2009, is situated in the scenic city of Boulder, Colorado."
business,1,The Outfit Faces Allegations of Disability Discrimination. The Entity's Unclear Use of Cash Collateral Under Review.
business,1,"The main office of The Institution is in the heart of Evansville, Indiana, with a team of 170 employees. The Group Announces Workshops for Annual Company Conference. The Group Faces Boycott Over Controversial Ad Campaign. The Operation's Unclear Ownership Structure Prompts Investigation."
business,1,"The Agency Partners with Real Estate Firm for Office Expansion. The Entity's Large Loans from Holding Company Under Scrutiny. Located in the vibrant city of Atlanta, Georgia, The Agency has been serving its clients since 1998."
business,1,"The Business Customers Disappointed by Lack of Innovation. The Business Faces Questions Over Off-Balance-Sheet Entities. Since 2014, The Venture has been operating from its main office in the vibrant city of Honolulu, Hawaii. The Outfit Launches Affiliate Program for Partner Collaboration."
business,1,"The Firm, a business that started in 1997, is located in the cultural hub of New Orleans, Louisiana. The Establishment's Unexplained Increase in Provisions for Risks and Charges Questioned. The Agency Implements Customer Relationship Management System for Better Engagement. The Agency Struggles with Customer Retention."
business,1,"The Establishment Announces New Distribution Channels for Market Penetration. The Business Struggles with Inventory Management. The Partnership's Sudden Surge in Mezzanine Financing Probed. In the industrial hub of South Bend, Indiana, The Partnership has been in business since 2003."
business,1,"The Institution Releases Annual Report Highlighting Growth and Achievements. The Establishment, founded in 2010, is situated in the scenic city of Providence, Rhode Island. The Corporation's Repeated Changes in Inventory Accounting Policies. The Enterprise Faces Criticism for Plastic Waste."
business,1,"The Enterprise, founded in 2002, conducts its business from its primary location in Denver, Colorado. The Enterprise's Unusual Patterns in Capital Lease Agreements. The Group Announces Winners of Employee Innovation Contest. The Firm Faces Backlash for Cultural Insensitivity."
business,1,"The Venture's Unclear Accounting for Postretirement Benefit Plans Flagged. The Group is based in the tech-savvy city of Raleigh, North Carolina, and was established in 2010. The Company Sponsors Local Community Garden to Promote Urban Agriculture."
business,1,"The Venture's Frequent Impairment Losses on Loans & Receivables. The Establishment Accused of Exploiting Consumers. The Corporation Announces Strategic Alliance for Market Synergy. The Agency, established in 2012, is located in the picturesque city of Little Rock, Arkansas."
business,1,The Group's Unclear Valuation of Investments in Joint Ventures. The Partnership Faces Criticism for Carbon Footprint.
business,1,"In the industrial hub of Pittsburgh, Pennsylvania, The Corporation has been in business since 2003. The Corporation's Sudden Surge in Investment Properties Flagged. The Concern CEO's Comments Spark Social Media Outrage."
business,1,"The Institution's Unexplained Changes in Lease-Related Lease Accounting Policy Elections. The Outfit Implements Talent Management System for Employee Development. The Institution Faces Allegations of Caregiver Status Discrimination. In the industrial hub of South Bend, Indiana, The Partnership has been in business since 2003."
business,1,"The Enterprise Opens New Retail Store for Expanded Reach. The Entity's Unclear Accounting for Business Combinations Flagged. The Enterprise Faces Criticism for Lack of Corporate Social Responsibility. In the heart of Toledo, Ohio, The Enterprise has been operational since 2004."
business,1,"The Entity's Abrupt Increase in Other Operating Expenses Noted. The Corporation Implements Cybersecurity Measures to Protect Data. The Concern CEO's Comments Spark Social Media Outrage. With a history dating back to 2009, The Business is based in the sunny city of Tampa, Florida."
business,1,"The Business Opens New Gym for Employee Fitness. The Operation Faces Allegations of Pregnancy Discrimination. The main office of The Firm is in the heart of Shreveport, Louisiana, with a team of 160 employees. The Partnership's Unexplained Increase in Other Comprehensive Income."
business,1,"The Institution's High Frequency of Franchise Agreements Examined. Since 2013, The Concern has been operating from its main office in the vibrant city of Newark, New Jersey. The Venture Welcomes New Distributors for Product Availability."
business,1,"The Concern Partners with Insurance Provider for Employee Benefits. The Concern Customers Report Issues with Warranty Claims. The Group's Unexplained Fluctuations in Distribution and Warehousing Expenses. The Establishment, founded in 2009, is situated in the scenic city of Boulder, Colorado."
business,1,The Institution Expands Product Offerings to Meet Customer Demand. The Entity's Complex Lease-Related Party Transactions Investigated.
business,1,"The Business Hosts Mental Health Awareness Seminar for Employee Support. The Venture Faces Backlash for Sexist Marketing. The Concern's Abrupt Increase in Prepaid Assets Noted. With a workforce of 150 employees, The Company operates from its main office in Austin, Texas."
business,1,"With a history dating back to 2007, The Firm is based in the sunny city of Orlando, Florida. The Enterprise Sponsors Local Book Fair to Promote Literacy. The Agency's Inconsistent Disclosures on Contingent Liabilities. The Establishment Faces Criticism for Lack of Diversity in Leadership."
business,1,The Partnership's Large Loans from Affiliates Under Scrutiny. The Company Accused of Colluding with Competitors. The Partnership Welcomes New Franchisees for Business Growth.
business,1,The Agency Partners with Real Estate Firm for Office Expansion. The Outfit's Abrupt Increase in Advertising & Promotion Expenses Flagged.
business,1,"The Outfit Under Scrutiny for Insider Trading. The Entity Launches Webinar Series on Professional Development Topics. Since its inception in 2008, The Business has been operating from its headquarters in Des Moines, Iowa. The Business's Complex Convertible Bond Transactions Draw Attention."
business,1,"The Corporation's Abrupt Shift in Supplier Financing Arrangements Raises Eyebrows. The Corporation CEO's Ethics Questioned by Media. The Venture, established in 2011, is located in the picturesque city of Memphis, Tennessee. The Business Hosts Family Day for Employees and Their Loved Ones."
business,1,"The Firm Faces Lawsuit Over Wrongful Termination. The Establishment's Unusual Patterns in Other Income Recognition. The main office of The Concern is in the bustling city of Grand Rapids, Michigan, with a staff of 140 employees. The Business Introduces 5G Technology for Faster Connectivity."
business,1,"The Group's Unexplained Fluctuations in Distribution and Warehousing Expenses. The Agency Launches Knowledge Base for Customer Self-Service. The Institution Faces Criticism for Air Pollution. Established in 2005, The Group runs its operations from its headquarters in Santa Rosa, California."
business,1,"The Business Releases Guide to Stress Management for Employees. The Entity's Abrupt Shift in Operating Cash Flow Raises Questions. The Operation Accused of Misleading Customers. Established in 2003, The Business runs its operations from its headquarters in Minneapolis, Minnesota."
business,1,The Company's Sudden Surge in Other Non-Operating Income. The Operation Under Investigation for Extortion.
business,1,"The Business, a business that started in 2000, is located in the historic city of Baltimore, Maryland. The Operation's Frequent Use of Accruals Noted. The Partnership Hosts Employee Appreciation Day for Team Recognition. The Business CEO's Reputation at Stake After Missteps."
business,1,"The Organization's Repeated Gains on Loans & Receivables. The Venture Customers Report Issues with Upgrade Process. The Outfit Hosts Anti-Harassment Training for Safe Work Environment. The Establishment operates from its main location in the charming city of Knoxville, Tennessee, since 2012."
business,1,"The Firm Accused of Violating Antitrust Laws. In the industrial hub of Birmingham, Alabama, The Outfit has been in business since 2004. The Entity Implements Green Initiatives to Promote Sustainability. The Firm's Complex Accounting for Compound Financial Instruments Noted."
business,1,"The Agency CEO's Performance Under Review by Board. The Organization's Abrupt Increase in Bad Debt Expense Flagged. The Venture Celebrates Milestone Anniversary with Community Event. Established in 2005, The Group runs its operations from its headquarters in Santa Rosa, California."
business,1,"The Corporation Releases Guide to Negotiation Skills for Employees. The Operation Struggles with Brand Awareness. The Concern, founded in 2009, is situated in the scenic city of Peoria, Illinois. The Operation's Unclear Ownership Structure Prompts Investigation."
business,1,"The Venture Faces Criticism for Water Usage. The Company's Frequent Gains on Derivative Instruments Noted. The Organization Opens New Innovation Lab for Product Development. In the industrial hub of Corpus Christi, Texas, The Entity has been in business since 2003."
business,1,"The Concern's Unorthodox Use of Peer-to-Peer Lending Questioned. The Agency, established in 2012, is located in the picturesque city of Little Rock, Arkansas. The Operation Welcomes Guest Speakers for Employee Inspiration."
business,1,The Outfit CEO's Actions Under Review After Complaints. The Firm's Unusual Patterns in Non-Operating Income Noted.
business,1,"The Establishment, founded in 2009, is situated in the scenic city of Anchorage, Alaska. The Operation Accused of Colluding with Government Officials. The Outfit's Unexplained Increase in Deferred Revenue Noted."
business,1,"The Business Releases Guide to Retirement Planning for Employees. The Group Under Scrutiny for Donations to Political Causes. The Group's Frequent Changes in Loss on Sale of Assets Raises Questions. In the heart of Springfield, Illinois, The Organization has been operational since 2004."
business,1,The Firm's Complex Equity-Settled Share-Based Payment Transactions. The Enterprise Struggles with High Turnover Rate.
business,1,"The Partnership Faces Lawsuit Over Emotional Distress. The Corporation Opens New Warehouse for Inventory Management. The Agency's Complex Series of Equity Transactions Under Review. The Firm, established in 2012, is located in the picturesque city of Fargo, North Dakota."
business,1,"The Institution Hosts Employee Resource Groups for Support and Networking. The Business's Unexplained Increase in Other Debtors Flagged. In the heart of St. Louis, Missouri, The Institution has been operational since 2003. The Firm Struggles with Brand Reputation."
business,1,"The Firm, a business that started in 1997, is located in the cultural hub of New Orleans, Louisiana. The Group Accused of Exploiting Suppliers. The Venture's Unexplained Changes in Accounting for Contract Assets Under Review. The Concern Releases Guide to Diversity and Inclusion for Employees."
business,1,"The Organization Faces Backlash for Xenophobic Remarks. The Establishment Hosts Creative Thinking Workshop for Employees. The Institution's Sudden Increase in Selling, General, and Administrative Expenses Flagged. The Operation, established in 2013, is located in the picturesque city of Savannah, Georgia."
business,1,"The main office of The Enterprise is in the heart of Columbus, Ohio, with a team of 180 employees. The Operation Launches Subscription Service for Customer Retention. The Establishment's Unexplained Large Loans from Foreign Banks. The Business Accused of Exploiting Labor in Developing Countries."
business,1,The Concern Faces Criticism for Lack of Accessibility Features. The Company's Inconsistent Application of Impairment Testing. The Outfit Introduces Augmented Reality for Enhanced Shopping Experience.
business,1,"The Company Sponsors Local Youth Sports League to Encourage Physical Activity. The Business, a business that started in 2000, is located in the historic city of Baltimore, Maryland. The Entity Customers Express Concerns Over Product Quality. The Operation's Complex Lease Accounting Practices Investigated."
business,1,"The Group Introduces Edge Computing for Reduced Latency. The Outfit Faces Backlash for Classist Comments. The Enterprise's Large Start-Up Costs Raise Questions. Established in 2005, The Venture runs its operations from its headquarters in Lexington, Kentucky."
business,1,"The Establishment, founded in 2009, is situated in the scenic city of Boulder, Colorado. The Business's Complex Intercompany Trade Transactions Draw Attention. The Concern Faces Backlash for Body-Shaming Marketing."
