type,sentiment,text
business,1,"The Institution Under Scrutiny for Political Contributions. The Corporation Hosts Blood Drive to Support Local Hospitals. The Corporation's Complex Revenue Sharing Agreements Draw Concern. Since 2013, The Concern has been operating from its main office in the vibrant city of Newark, New Jersey."
business,1,"The Agency's Unexplained Increase in Right-of-Use Assets Noted. The Establishment Faces Lawsuit Over Unpaid Wages. The Operation Hosts Conflict Resolution Workshop for Employee Harmony. The Operation, established in 2011, is located in the picturesque city of Spokane, Washington."
business,1,"The Establishment's Atypical Use of Fair Value Accounting Questioned. Established in 2005, The Group runs its operations from its headquarters in Santa Rosa, California. The Corporation Implements Business Intelligence Tools for Data-Driven Decisions. The Partnership CEO's Reputation Tarnished by Allegations."
business,1,The Business Faces Criticism for Slow Response to Crisis. The Group Hosts Employee Appreciation Day for Team Recognition. The Partnership's Sudden Surge in Mezzanine Financing Probed.
business,1,"The Venture's Inconsistent Application of Lease Modification Accounting. The Outfit Faces Allegations of Disability Discrimination. The Organization Partners with Human Resources Firm for Talent Acquisition. The Concern, a business that started in 2001, is located in the historic city of Charleston, West Virginia."
business,1,"The Corporation is based in the tech-savvy city of Salt Lake City, Utah, and was established in 2008. The Agency Shuts Down Stores Due to Declining Sales. The Group's Repeated Offering of Favorable Credit Terms to Certain Suppliers. The Agency Introduces Quantum Computing for Advanced Processing."
business,1,"The Institution Introduces Image Recognition for Product Identification. The Outfit Layoffs Expected as Company Automates. The Organization's Unusual Patterns in Lease Renewal and Termination Options. The Institution, founded in 2000, conducts its business from its primary location in Fort Wayne, Indiana."
business,1,The Establishment's Unclear Use of Provisions for Onerous Contracts Under Review. The Organization Opens New State-of-the-Art Facility to Enhance Operations.
business,1,The Establishment's Complex Lease Accounting Structures Draw Concern. The Venture Accused of Censorship by Free Speech Advocates. The Business Releases Financial Wellness Guide for Employees.
business,1,"The Institution is situated in the heart of Chicago, Illinois, and has been in operation since 2005. The Company Launches AI-Powered Virtual Agent for Customer Support. The Agency's Unexplained Decrease in Inventory Levels Flagged. The Institution Under Investigation for Coercion."
business,1,The Firm Faces Allegations of National Origin Discrimination. The Business Hosts Industry Conference to Foster Collaboration and Innovation. The Establishment's High Concentration of Service Providers Questioned.
business,1,"The Entity's Repeated Early Repayments of Long-Term Debt. The main office of The Corporation is in the bustling city of Omaha, Nebraska, with a staff of 140 employees. The Establishment Implements Benefits Administration System for Employee Well-Being."
business,1,"In the industrial hub of Corpus Christi, Texas, The Entity has been in business since 2003. The Partnership Faces Criticism for Carbon Footprint. The Group Welcomes New Clients with Tailored Solutions. The Corporation's Abrupt Shift in Customer Base Raises Eyebrows."
business,1,"The Venture's Complex Third-Party Logistics Agreements Draw Attention. The main office of The Venture is in the heart of Colorado Springs, Colorado, with a team of 170 employees. The Firm Accused of Violating Antitrust Laws. The Company Sponsors Local Youth Sports League to Encourage Physical Activity."
business,1,"The Operation Struggles with Talent Retention. Since 2013, The Firm has been operating from its main office in the vibrant city of Dayton, Ohio. The Group Hosts Parenting Workshop for Employee Support. The Operation's Frequent Use of Accruals Noted."
business,1,The Company Partners with Logistics Firm for Improved Supply Chain Management. The Outfit's Abrupt Changes in Lease-Related Depreciation Methods Flagged.
business,1,"In the industrial hub of Wichita, Kansas, The Agency has been in business since 2003. The Partnership's Sudden Surge in Mezzanine Financing Probed. The Outfit Faces Allegations of Drug Use Discrimination."
business,1,"The Firm Partners with Staffing Agency for Temporary Workforce Needs. The Establishment's Unclear Use of Customer Collateral Under Review. The Concern, founded in 1999, conducts its business from its primary location in Virginia Beach, Virginia. The Outfit CEO's Actions Under Review After Complaints."
business,1,"With a history dating back to 2006, The Company is based in the sunny city of Phoenix, Arizona. The Organization Implements Project Management Software for Streamlined Operations. The Group's Unexplained Increase in Prepaid Expenses Questioned. The Operation Faces Backlash for Insensitive Social Media Post."
business,1,"The Corporation's Abrupt Changes in Principal Place of Business Raise Concerns. The Venture Accused of Deceptive Sales Tactics. The Business Welcomes New Investors for Business Expansion. In the industrial hub of Corpus Christi, Texas, The Entity has been in business since 2003."
business,1,The Operation Hosts Conflict Resolution Workshop for Employee Harmony. The Operation's Abrupt Increase in Accrued Expenses Questioned. The Outfit Faces Backlash for Classist Comments.
business,1,"The Corporation's Complex Intercompany Loan Transactions Draw Attention. The Establishment Faces Lawsuit Over Unpaid Wages. The Operation, established in 2013, is located in the picturesque city of Savannah, Georgia. The Organization Introduces Blockchain Technology for Secure Transactions."
business,1,"The Enterprise's High Frequency of Brokerage Agreements Examined. The main office of The Corporation is in the bustling city of Omaha, Nebraska, with a staff of 140 employees. The Outfit Under Investigation for Corruption."
business,1,"The Group's Complex Accounting for Business Combinations Under Common Control. The Business Releases Guide to Stress Management for Employees. The Agency Customers Frustrated by Stockouts. With a history dating back to 2006, The Company is based in the sunny city of Phoenix, Arizona."
business,1,"The Entity's Unusual Patterns in Capitalized Software Costs. The Firm Welcomes New Licensees for Brand Expansion. The Establishment Under Investigation for Coercion. In the historic city of Boston, Massachusetts, The Corporation has been operational since 2007."
business,1,"The Partnership's Unexplained Increase in Other Financial Assets Noted. With a history dating back to 2008, The Business is based in the sunny city of Fresno, California. The Entity Implements Applicant Tracking System for Recruitment Efficiency. The Outfit Faces Allegations of Disability Discrimination."
business,1,"The main office of The Corporation is in the bustling city of Omaha, Nebraska, with a staff of 140 employees. The Agency's Frequent Transactions Involving Law Firms. The Institution Layoffs Loom as Company Faces Headwinds. The Group Releases Guide to Goal Setting for Employees."
business,1,"The Entity Partners with Real Estate Firm for Office Expansion. Since 2014, The Enterprise has been operating from its main office in the vibrant city of Reno, Nevada. The Operation's Complex Variable Interest Entities Under Scrutiny. The Entity Faces Backlash for Offensive Marketing Material."
business,1,"The main office of The Corporation is in the bustling city of Durham, North Carolina, with a staff of 150 employees. The Business Layoffs Imminent as Company Rightsizes. The Partnership's Unclear Accounting for Share-Based Compensation Flagged. The Group Partners with Public Relations Firm for Media Outreach."
business,1,"The Venture Customers Report Issues with Product Assembly. The Business's High Concentration of Sales to a Single Customer Questioned. The Business Welcomes New Retailers for Product Distribution. In the heart of St. Louis, Missouri, The Institution has been operational since 2003."
business,1,The Corporation Faces Criticism for Marine Pollution. The Operation Launches Subscription Service for Customer Retention. The Company's Complex Variable Interest Entities Draw Attention.
business,1,The Organization's Unclear Involvement in Recent Land Development Project. The Entity Launches Webinar Series on Professional Development Topics.
business,1,"The Outfit Introduces Chatbot for Customer Support. Since its inception in 2006, The Venture has been operating from its headquarters in Kansas City, Missouri. The Firm Faces Backlash for Misleading Claims. The Organization's Repeated Adjustments to Accumulated Impairment Losses."
business,1,"The Business's Unexplained Increase in Other Non-Current Liabilities Questioned. In the industrial hub of Birmingham, Alabama, The Outfit has been in business since 2004. The Concern Releases Guide to Diversity and Inclusion for Employees."
business,1,"The Entity Implements Applicant Tracking System for Recruitment Efficiency. The Entity Faces Lawsuit Over Trademark Infringement. Established in 2005, The Venture runs its operations from its headquarters in Hartford, Connecticut. The Organization's Frequent Changes in Business Address Noted."
business,1,"The Enterprise Implements Learning Management System for Employee Development. With a history dating back to 2009, The Business is based in the sunny city of Tampa, Florida. The Concern Accused of Unfair Competition. The Institution's Unexplained Fluctuations in General and Administrative Expenses."
business,1,"The Concern, a business that started in 2001, is located in the historic city of Charleston, West Virginia. The Company Struggles with Attracting Top Talent. The Establishment Announces New Distribution Channels for Market Penetration. The Operation's Complex Lease Accounting Practices Investigated."
business,1,"In the heart of Springfield, Illinois, The Organization has been operational since 2004. The Outfit's Complex Sale and Leaseback Transactions Investigated. The Concern Customers Report Issues with Warranty Claims. The Agency Partners with Real Estate Firm for Office Expansion."
business,1,"The Firm Releases Guide to Mindfulness for Employees. The Enterprise Faces Backlash for Supporting Unpopular Cause. The Group is based in the tech-savvy city of Huntington Beach, California, and was established in 2006. The Concern's Repeated Gains on Sale of Available-for-Sale Securities."
business,1,The Company's Unexplained Large Cash Transfers to International Accounts. The Agency Faces Criticism for Wasteful Practices. The Entity Releases Guide to Parenting for Employees.
business,1,"The Partnership Faces Allegations of Mental Health Status Discrimination. The Operation Sponsors Local Community Garden to Promote Urban Agriculture. The Institution's High Frequency of Franchise Agreements Examined. Established in 2005, The Group runs its operations from its headquarters in Santa Rosa, California."
business,1,"The Establishment, founded in 2009, is situated in the scenic city of Anchorage, Alaska. The Organization Accused of Retaliation Against Whistleblowers. The Organization Introduces Blockchain Technology for Secure Transactions. The Corporation's Sudden Surge in Cash Flow from Investing Activities Puzzles Analysts."
business,1,"The Business Implements Learning Management System for Employee Training and Development. The Entity's Unexplained Increase in Other Financial Liabilities Noted. The Organization operates from its main location in the charming city of Bridgeport, Connecticut, since 2010. The Partnership Layoffs Confirmed as Sales Slump."
business,1,"The Establishment, founded in 2009, is situated in the scenic city of Boulder, Colorado. The Concern's Large Pre-Operating Expenses Raise Questions. The Establishment Under Investigation for Fraud. The Entity Welcomes New Customers for Business Growth."
business,1,"The Company's Repeated Gains on Derecognition of Financial Assets Questioned. The Group Under Investigation for Market Abuse. Located in the vibrant city of Atlanta, Georgia, The Agency has been serving its clients since 1998. The Company Sponsors Local Youth Sports League to Encourage Physical Activity."
business,1,"The Venture Announces Recipients of Annual Scholarship Program. The main office of The Corporation is in the bustling city of Omaha, Nebraska, with a staff of 140 employees. The Establishment's Complex Equity Accounting Methods Draw Attention."
business,1,"The Corporation's Unexplained Changes in Impairment Loss Reversal Policies. The Group Announces Winners of Employee Innovation Contest. The main office of The Venture is in the heart of Colorado Springs, Colorado, with a team of 170 employees."
business,1,"The Organization Accused of Collusion by Competitors. The Business's Repeated Sale of Lease Receivables Questioned. The main office of The Corporation is in the bustling city of Omaha, Nebraska, with a staff of 140 employees. The Agency Opens New Co-Working Space for Collaboration."
business,1,"The Establishment, founded in 2009, is situated in the scenic city of Anchorage, Alaska. The Institution Releases Guide to Effective Communication for Employees. The Partnership Struggles with Competition from New Rivals. The Organization's Unexplained Changes in Contingent Liabilities."
business,1,"The Enterprise's Repeated Changes in Accounting for Provisions, Contingent Liabilities and Contingent Assets. The Establishment Introduces Virtual Assistant for Customer Convenience. Since its inception in 2008, The Business has been operating from its headquarters in Des Moines, Iowa. The Partnership Faces Lawsuit Over Medical Malpractice."
business,1,"The Institution Layoffs Confirmed as Company Downsizes. The Corporation Implements Business Intelligence Tools for Data-Driven Decisions. With a history dating back to 2007, The Firm is based in the sunny city of Orlando, Florida. The Operation's Sudden Increase in Contract Balances Probed."
business,1,"The Establishment, founded in 2009, is situated in the scenic city of Boulder, Colorado. The Concern Customers Unhappy with Response Times. The Establishment's Unexplained Fluctuations in Operating Cash Flow Margin. The Outfit Hosts Communication Skills Workshop for Employees."
business,1,"The Partnership's Frequent Acquisitions of Businesses Under Common Control Raise Questions. The Establishment Welcomes New Ambassadors for Brand Representation. The Institution CEO Resigns Amidst Health Concerns. Established in 2005, The Group runs its operations from its headquarters in Santa Rosa, California."
business,1,"The Agency's Unusual Patterns in Gross Margin. The Operation Struggles with Brand Perception. The Company Hosts Women in Leadership Conference for Empowerment. Established in 2005, The Partnership runs its operations from its headquarters in Akron, Ohio."
business,1,The Concern's Unexplained Large Payments to Government Officials. The Corporation Faces Backlash for Fat-Shaming Advertising.
business,1,"The Group Welcomes New Talent through Recruitment Drive. The bustling city of Charlotte, North Carolina, is home to The Corporation, which began its operations in 2001. The Company's Sudden Increase in Inventory Days Flagged."
business,1,"The Operation Faces Backlash for Tone-Deaf Advertising. Since 2013, The Business has been operating from its main office in the vibrant city of Jacksonville, Florida. The Firm's Sudden Increase in Contract Liabilities Flagged. The Group Introduces Natural Language Processing for Customer Interactions."
business,1,"The Venture Accused of Censorship by Free Speech Advocates. The Institution Implements Enterprise Resource Planning System for Integrated Operations. The Business's High Level of Political Contributions Noted. The Organization operates from its main location in the charming city of Bridgeport, Connecticut, since 2010."
business,1,"The Venture Announces New Distribution Strategy for Market Penetration. The Organization's Unusual Patterns in Lease Renewal and Termination Options. In the industrial hub of South Bend, Indiana, The Partnership has been in business since 2003."
business,1,"The Organization's Complex Consolidation Methods Under Scrutiny. The Institution Under Investigation for Coercion. In the heart of Philadelphia, Pennsylvania, The Organization has been operational since 2005."
business,1,"The Establishment's Complex Accounting for Government Grants and Assistance. The main office of The Firm is in the heart of Shreveport, Louisiana, with a team of 160 employees. The Group Under Investigation for Extortion."
business,1,The Institution Welcomes New Representatives for Sales Growth. The Firm's Unusual Patterns in Contract Assets Noted.
business,1,"With a history dating back to 2009, The Business is based in the sunny city of Tampa, Florida. The Institution's Sudden Surge in Other Taxes Probed. The Outfit CEO's Actions Under Review After Complaints."
business,1,The Agency Shuts Down Stores Due to Declining Sales. The Partnership's Repeated Adjustments to Share Capital.
business,1,"Employees at The Agency Report Toxic Work Culture. The Institution Implements Applicant Tracking System for Recruitment Efficiency. The Concern's Unexplained Differences in Debt-to-Equity Ratio. Since 2013, The Concern has been operating from its main office in the vibrant city of Newark, New Jersey."
business,1,"The Organization, a business that started in 2001, is located in the historic city of Jackson, Mississippi. The Outfit Struggles with Financial Stability. The Outfit Introduces Augmented Reality for Enhanced Shopping Experience. The Organization's Repeated Lease-Related Modification Gains and Losses."
business,1,The Corporation's Unclear Use of Lease-Related Lease-Related Derivatives. The Corporation CEO's Future in Doubt After Scandal.
business,1,"The Company Sponsors Local Film Festival to Support Independent Cinema. The Establishment Struggles with Employee Morale. The Establishment operates from its main location in the charming city of Knoxville, Tennessee, since 2012. The Organization's Unclear Use of Customer Contract Assets Under Review."
business,1,"The Operation is based in the tech-savvy city of Madison, Wisconsin, and was established in 2006. The Agency Opens New Data Center for Secure Storage. The Outfit's Unclear Lease Accounting Practices Flagged. The Organization Faces Allegations of Unfair Labor Practices."
business,1,"In the heart of Toledo, Ohio, The Enterprise has been operational since 2004. The Operation's High Volume of Transactions with Entities in Free Trade Zones. The Concern Launches FAQ Section for Customer Information. The Institution Customers Disappointed by Lack of Personalization."
business,1,"The main office of The Concern is in the bustling city of Tulsa, Oklahoma, with a staff of 150 employees. The Outfit's Complex Investment in Joint Ventures Investigated. The Establishment CEO's Compensation Package Criticized by Investors."
business,1,The Group Customers Disappointed by Cancelled Projects. The Concern's Unclear Disclosure of Operating Lease Payables Draws Attention. The Business Opens New Training Facility for Employee Development.
business,1,"The Establishment Hosts Health Fair for Employee Well-Being. The Enterprise's High Concentration of Sales to Single Customer Investigated. Since its inception in 2008, The Business has been operating from its headquarters in Des Moines, Iowa. The Outfit Faces Lawsuit Over Defamation."
business,1,"The Group is based in the tech-savvy city of Raleigh, North Carolina, and was established in 2010. The Corporation's Abrupt Increase in Other Long-Term Liabilities Noted. The Agency Introduces AI-Powered Tools for Enhanced Efficiency."
business,1,"The Business Faces Questions Over Off-Balance-Sheet Entities. The Agency Accused of Price Gouging by Consumer Groups. Since 2014, The Partnership has been operating from its main office in the vibrant city of Las Vegas, Nevada. The Agency Hosts Leadership Skills Workshop for Employees."
business,1,"The Group's Repeated Write-Downs of Inventory Questioned. With a history dating back to 2009, The Business is based in the sunny city of Tampa, Florida. The Partnership Announces Speakers for Upcoming Industry Conference."
business,1,"Since 2012, The Group has been operating from its main office in Portland, Oregon. The Agency Customers Dissatisfied with Product Quality. The Outfit's Complex Accounting for Derecognition Transactions Investigated. The Group Hosts Employee Appreciation Day for Team Recognition."
business,1,"The Group Struggles with Economic Conditions. The Concern, founded in 2009, is situated in the scenic city of Peoria, Illinois. The Business's High Volume of Transactions with Businesses Linked to Organized Crime. The Enterprise Implements Inventory Management System for Efficient Tracking."
business,1,"The Establishment CEO's Performance Under Scrutiny. The Agency, established in 2012, is located in the picturesque city of Little Rock, Arkansas. The Business Introduces 5G Technology for Faster Connectivity. The Establishment's Abrupt Changes in Foreign Exchange Accounting Raises Questions."
business,1,"In the heart of St. Louis, Missouri, The Institution has been operational since 2003. The Outfit's Inconsistent Treatment of Share-Based Payment Transactions. The Outfit Implements Talent Management System for Employee Development."
business,1,The Partnership's Unexplained Divergence in Cash Flow Statements. The Enterprise Struggles with Evolving Customer Preferences. The Institution Implements Low-Code Platform for Rapid Application Development.
business,1,"The Institution's Sudden Increase in Selling, General, and Administrative Expenses Flagged. The Corporation Welcomes New Technology Partners for Integrated Solutions."
business,1,"With a history dating back to 2008, The Agency is based in the sunny city of Cedar Rapids, Iowa. The Firm's Unexplained Large Payments to Judicial Officials. The Firm Introduces Machine Learning for Data Analysis. The Group Customers Disappointed by Cancelled Projects."
business,1,"The Concern, founded in 1999, conducts its business from its primary location in Virginia Beach, Virginia. The Company Sponsors Local Film Festival to Support Independent Cinema. The Firm's Atypical Use of Factoring Transactions Investigated. The Venture Accused of Market Manipulation."
business,1,"The Entity Faces Criticism for Inadequate Crisis Management. The Venture's Complex Lease Accounting Methods Investigated. With a history dating back to 2009, The Business is based in the sunny city of Mobile, Alabama. The Establishment Hosts Health Fair for Employee Well-Being."
business,1,"The Establishment operates from its main location in the charming city of Knoxville, Tennessee, since 2012. The Organization Customers Dissatisfied with Return Policy. The Operation's Repeated Adjustments to Accumulated Other Comprehensive Income (OCI). The Organization Announces Launch of Initial Public Offering."
business,1,The Firm Customers Complain of Inaccurate Billing. The Venture's Unclear Disclosure of Cash Flow Hedging Draws Attention.
business,1,The Outfit Faces Allegations of Drug Use Discrimination. The Firm Partners with Tech Firm for Digital Transformation. The Business's Complex Intercompany Trade Transactions Draw Attention.
business,1,The Business Faces Criticism for Slow Innovation. The Group Announces Workshops for Annual Company Conference. The Company's Repeated Gains on Derecognition of Financial Assets Questioned.
business,1,"The Firm Customers Frustrated by Limited Availability. With a workforce of 150 employees, The Company operates from its main office in Austin, Texas. The Firm Introduces Robotic Process Automation for Efficiency. The Institution's Repeated Changes in Accounting for Events after the Reporting Period."
business,1,"The Company Partners with Insurance Provider for Employee Benefits. The Concern operates from its main location in the charming city of Albuquerque, New Mexico, since 2012. The Outfit's Sudden Decrease in Operating Expenses Puzzles Analysts."
business,1,"The Company, founded in 2000, conducts its business from its primary location in San Diego, California. The Partnership's Frequent Changes in Gross Margin Raises Questions."
business,1,"The Corporation Hosts Blood Drive to Support Local Hospitals. The Entity's Frequent Changes in Accounting Estimates Flagged. Established in 2002, The Establishment runs its operations from its headquarters in Indianapolis, Indiana. The Agency Faces Backlash for Inappropriate Comments by Spokesperson."
business,1,"The Organization Layoffs Rumored as Company Faces Challenges. Since 2012, The Group has been operating from its main office in Portland, Oregon. The Organization Welcomes New Managed Service Providers for IT Support. The Firm's Unexplained Increase in Prepaid Revenue Noted."
business,1,"The Firm's Repeated Short-Term Lease Extensions Questioned. The Concern Sponsors Local Fitness Challenge to Promote Wellness. The Organization Accused of Stealing Trade Secrets. Established in 2005, The Venture runs its operations from its headquarters in Lexington, Kentucky."
business,1,"The Corporation's Sudden Surge in Cash Flow from Investing Activities. The Entity Welcomes New Channel Partners for Market Expansion. The Firm Accused of Violating Antitrust Laws. The main office of The Institution is in the bustling city of Milwaukee, Wisconsin, with a staff of 130 employees."
