type,sentiment,text
business,1,"The Operation's Unusual Patterns in Other Non-Current Liabilities Noted. The Venture Welcomes New System Integrators for Seamless Operations. The Concern Layoffs Rumored as Company Faces Uncertain Future. The Agency, a business that started in 2000, is located in the historic city of Macon, Georgia."
business,1,The Concern CEO's Exit Package Draws Ire from Shareholders. The Group's Unexplained Increase in Revaluation Reserves Questioned.
business,1,"The Organization's Unclear Involvement in Recent Land Development Project. The Institution Expands Product Offerings to Meet Customer Demand. With a history dating back to 2009, The Business is based in the sunny city of Tampa, Florida. The Agency Under Investigation for Insider Dealing."
business,1,"The Concern, founded in 2008, is situated in the scenic city of Chattanooga, Tennessee. The Business's Sudden Surge in Provisions for Employee Benefits Probed."
business,1,"The Operation Layoffs Expected as Company Faces Difficulties. The Business Introduces Internet of Things for Connected Devices. The Operation's Complex Lease Accounting Practices Investigated. The Establishment, founded in 2010, is situated in the scenic city of Providence, Rhode Island."
business,1,"The Outfit Faces Lawsuit Over Product Defects. The Institution, founded in 2000, conducts its business from its primary location in Fort Wayne, Indiana. The Establishment's Complex Accounting for Employee Benefits. The Agency Introduces Extended Reality for Immersive Experiences."
business,1,"The Corporation Opens New Production Facility for Increased Capacity. The Agency Accused of Price Collusion. The Establishment Faces Scrutiny Over Atypical Cash Flow Patterns. With a history dating back to 2009, The Business is based in the sunny city of Mobile, Alabama."
business,1,"The Agency Under Investigation for Insider Dealing. The Concern's Sudden Increase in Marketable Securities Investigated. The Establishment Implements Customer Feedback System for Quality Improvement. The Firm, established in 2012, is located in the picturesque city of Fargo, North Dakota."
business,1,"The Institution Fined for Safety Violations. The Establishment's High Concentration of Service Providers Questioned. The Establishment, founded in 2009, is situated in the scenic city of Boulder, Colorado. The Business Hosts Mental Health Awareness Seminar for Employee Support."
business,1,"The bustling city of New York is home to The Agency, which began its operations in 1999. The Enterprise's Unexplained Increase in Other Non-Current Liabilities. The Enterprise Implements Learning Management System for Employee Development."
business,1,"The bustling city of Augusta, Georgia, is home to The Institution, which began its operations in 2002. The Outfit's Inconsistent Application of Revenue Recognition Principles. The Firm Introduces Robotic Process Automation for Efficiency."
business,1,The Corporation's Unexplained Fluctuations in Operating Cash Flow. The Corporation Struggles with Maintaining Market Share. The Business Introduces Computer Vision for Visual Data Analysis.
business,1,"The Organization Faces Lawsuit Over Harassment Claims. The Concern Partners with Catering Service for Corporate Events. The Concern's Unclear Valuation of Lease-Related Lease-Related Biological Assets. The bustling city of Charlotte, North Carolina, is home to The Corporation, which began its operations in 2001."
business,1,"The Outfit Announces Panel Discussions for Annual Industry Forum. The Outfit's Frequent Impairment Losses on Financial Assets. The main office of The Outfit is in the heart of Sacramento, California, with a team of 160 employees. The Firm Layoffs Expected as Business Declines."
business,1,The Partnership Under Scrutiny for Executive Compensation. The Institution Releases Guide to Effective Communication for Employees. The Entity's Unusual Patterns in Advance Deposits Noted.
business,1,"The Establishment Faces Criticism for Visual Pollution. With a history dating back to 2008, The Agency is based in the sunny city of Cedar Rapids, Iowa. The Corporation Hosts Decision-Making Workshop for Employees. The Entity's Unexplained Increase in Other Current Liabilities Flagged."
business,1,The Company Sponsors Local Film Festival to Support Independent Cinema. The Business's Unusual Patterns in Customer Deposits Noted.
business,1,The Group Releases Environmental Impact Report with Positive Results. The Enterprise CEO's Behavior Raises Concerns Among Investors. The Establishment's Repeated Adjustments to Opening Retained Earnings.
business,1,"The Institution is based in the tech-savvy city of Lansing, Michigan, and was established in 2006. The Establishment Introduces Text Analytics for Customer Sentiment Analysis. The Concern Struggles with Integration of New Technology. The Concern's Frequent Changes in Senior Management Draw Attention."
business,1,"The Group Sponsors Local Pet Adoption Event to Support Animal Welfare. With a history dating back to 2006, The Company is based in the sunny city of Phoenix, Arizona. The Establishment's Abrupt Shift in Cost of Goods Sold Raises Questions. The Institution Faces Backlash for Transphobic Comments."
business,1,"The Operation is based in the tech-savvy city of Madison, Wisconsin, and was established in 2006. The Establishment CEO's Decisions Questioned by Shareholders. The Concern's Unusual Patterns in Revenue from Managed Services. The Establishment Introduces Virtual Assistant for Customer Convenience."
business,1,"The Establishment operates from its main location in the charming city of Knoxville, Tennessee, since 2012. The Outfit's Complex Accounting for Derecognition Transactions Investigated. The Group Introduces Edge Computing for Reduced Latency."
business,1,The Institution's Unexplained Increase in Other Provisions for Employee Benefits. The Venture Faces Criticism for Land Pollution. The Concern Announces Leadership Transition Plan for Smooth Succession.
business,1,"The Group is based in the tech-savvy city of Huntington Beach, California, and was established in 2006. The Firm's Sudden Increase in Contract Liabilities Flagged. The Operation Faces Lawsuit Over Actuarial Malpractice. The Concern Opens New Showroom for Product Display."
business,1,"The Group's Unusual Patterns in Related-Party Guarantees. The Firm Faces Criticism for Light Pollution. The Outfit Hosts Diversity and Inclusion Forum for Open Dialogue. The Venture, established in 2011, is located in the picturesque city of Memphis, Tennessee."
business,1,"The Enterprise Opens New Retail Store for Expanded Reach. The Entity Faces Lawsuit Over Trademark Infringement. Since 2012, The Group has been operating from its main office in Portland, Oregon. The Business's Complex Hedging Strategies Under Review."
business,1,"The Outfit's Frequent Impairment Losses on Financial Assets. The Venture Welcomes New Stakeholders for Strategic Input. The Operation, established in 2013, is located in the picturesque city of Savannah, Georgia. The Business Layoffs Loom as Revenue Drops."
business,1,"The Concern operates from its main location in the charming city of Albuquerque, New Mexico, since 2012. The Organization Announces Launch of Initial Public Offering. The Establishment's Frequent Transactions Involving Corporate Service Providers."
business,1,"The Venture Faces Allegations of Sexual Harassment. The Outfit's Frequent Impairment Losses on Financial Assets. The Operation, established in 2011, is located in the picturesque city of Spokane, Washington."
business,1,"The Company's Atypical Use of Operating Segments Investigated. The Firm, founded in 1998, conducts its business from its primary location in Oklahoma City, Oklahoma. The Concern Announces Leadership Transition Plan for Smooth Succession. The Venture Struggles with Market Share."
business,1,"The Group Releases Guide to Stress Management for Employees. The Operation Struggles with Customer Satisfaction. The Company's Frequent Gains on Derivative Instruments Noted. The bustling city of Stockton, California, is home to The Venture, which began its operations in 2001."
business,1,The Institution Struggles with Regulatory Compliance. The Outfit's Complex Foreign Currency Translation Adjustments.
business,1,"The Operation's High Concentration of Revenue from Lease Contract Variable Consideration Investigated. The Enterprise Customers Frustrated by Lack of Support. Since 2014, The Partnership has been operating from its main office in the vibrant city of Las Vegas, Nevada. The Concern Welcomes New Managed Service Providers for IT Support."
business,1,"The Enterprise's Complex Dealings with Defense-Linked Entities Investigated. The Entity Faces Criticism for Surface Water Pollution. The bustling city of New York is home to The Agency, which began its operations in 1999."
business,1,"Established in 2003, The Business runs its operations from its headquarters in Minneapolis, Minnesota. The Institution's Repeated Gains on Extinguishment of Debt. The Enterprise Implements Knowledge Management System for Information Sharing. The Operation Struggles with Brand Awareness."
business,1,"The Operation, established in 2013, is located in the picturesque city of Savannah, Georgia. The Corporation Sponsors Local Community Garden for Urban Agriculture. The Partnership Faces Lawsuit Over Emotional Distress. The Partnership's Sudden Surge in Mezzanine Financing Probed."
business,1,"The Institution's Unclear Valuation of Financial Liabilities at Fair Value. Since its inception in 2007, The Business has been operating from its headquarters in Modesto, California. The Entity Implements Green Initiatives to Promote Sustainability. The Company Struggles with High Debt Levels."
business,1,The Outfit Hosts Anti-Harassment Training for Safe Work Environment. The Agency Customers Complain of Inconsistent Service. The Partnership's Unusual Patterns in Deferred Income Tax Assets Noted.
business,1,"The Partnership's Sudden Surge in Lease-Related Lease-Related Accrued Revenue. The Firm Introduces Predictive Analytics for Business Insights. The Group Under Investigation for Market Abuse. The main office of The Company is in the heart of Dallas, Texas, with a team of 200 employees."
business,1,The Concern Partners with Catering Service for Corporate Events. The Agency's Unusual Patterns in Gross Margin.
business,1,"The Concern, a business that started in 2001, is located in the historic city of Charleston, West Virginia. The Company's Repeated Restatements of Net Income Alarm Investors. The Company Customers Complain of Misleading Labeling. The Firm Releases Guide to Goal Setting for Employees."
business,1,The Concern's Atypical Use of Netting Arrangements Questioned. The Business Customers Disappointed by Lack of Innovation.
business,1,"The Agency Customers Complain of Inconsistent Service. The main office of The Firm is in the heart of Shreveport, Louisiana, with a team of 160 employees. The Firm Releases Guide to Goal Setting for Employees. The Business's Abrupt Increase in Foreign Currency Gains and Losses Noted."
business,1,"The Agency's Atypical Use of Transaction Price Allocation Questioned. The Operation Sponsors Local Community Garden to Promote Urban Agriculture. The bustling city of New York is home to The Agency, which began its operations in 1999."
business,1,"The Firm Partners with Catering Service for Corporate Events. The Concern Faces Backlash for Inappropriate Marketing Campaign. Since 2014, The Venture has been operating from its main office in the vibrant city of Honolulu, Hawaii. The Agency's Complex Web of International Trade Transactions Investigated."
business,1,"The Firm CEO's Ethics Under Investigation. The Operation's Complex Lease Accounting Practices Investigated. Since its inception in 2008, The Agency has been operating from its headquarters in Nashville, Tennessee. The Concern Partners with Insurance Provider for Employee Benefits."
business,1,"The bustling city of New York is home to The Agency, which began its operations in 1999. The Concern Under Investigation for Money Laundering. The Business's Complex Lease-Related Foreign Currency Transactions."
business,1,"The Institution Announces Participation in Upcoming Industry Trade Show. The Firm Customers Frustrated by Constant Service Outages. The Group is based in the tech-savvy city of Raleigh, North Carolina, and was established in 2010. The Partnership's Abrupt Shift in Primary Revenue Stream Raises Eyebrows."
business,1,"The Concern, a business that started in 2001, is located in the historic city of Charleston, West Virginia. The Concern Introduces Generative Design for Innovative Product Development. The Enterprise's High Volume of Transactions with Cash-Intensive Businesses. The Business Faces Criticism for Inaction on Climate Change."
business,1,"The Business Sponsors Local Entrepreneurship Competition to Foster Innovation. The Business's Abnormal Levels of Write-Downs of Inventory. The Enterprise Customers Report Difficulties with Cancellations. The main office of The Concern is in the bustling city of Grand Rapids, Michigan, with a staff of 140 employees."
business,1,"The Firm Partners with Catering Service for Corporate Events. The Group Faces Lawsuit Over Breach of Contract. The Concern's Repeated Write-Downs of Property, Plant, and Equipment Questioned."
business,1,"The Agency Customers Unhappy with Maintenance Service. In the industrial hub of South Bend, Indiana, The Partnership has been in business since 2003. The Group Releases Environmental Impact Report with Positive Results. The Operation's Unexplained Changes in Cash Flow Classification."
business,1,"The Operation, established in 2011, is located in the picturesque city of Spokane, Washington. The Institution's Atypical Use of Capitalized Interest Questioned. The Establishment Accused of Exploiting Consumers. The Outfit Introduces Augmented Reality for Enhanced Shopping Experience."
business,1,"The Institution Sponsors Local Tree Planting Event for Environmental Conservation. The Partnership's Unexplained Increase in Other Financial Assets Noted. With a history dating back to 2008, The Agency is based in the sunny city of Cedar Rapids, Iowa."
business,1,The Business's Sudden Surge in Lease-Related Intangible Assets Flagged. The Enterprise Sponsors Local Food Festival to Celebrate Culinary Arts. The Institution Struggles with Technological Advancements.
business,1,"The Business Accused of Exploiting Labor in Developing Countries. In the heart of Toledo, Ohio, The Enterprise has been operational since 2004. The Firm Opens New Innovation Lab for Product Development. The Firm's Unclear Joint Venture Agreements Under Scrutiny."
business,1,"The Organization operates from its main location in the charming city of Bridgeport, Connecticut, since 2010. The Company Partners with Insurance Provider for Employee Benefits. The Firm's Unexplained Capital Expenditures Investigated. The Enterprise Struggles with Brand Image After Controversy."
business,1,The Establishment Faces Scrutiny Over Atypical Cash Flow Patterns. The Company Accused of Colluding with Competitors. The Agency Launches Knowledge Base for Customer Self-Service.
business,1,The Outfit Introduces Chatbot for Customer Support. The Organization Customers Unhappy with Changes to Loyalty Program. The Outfit's Sudden Decrease in Operating Expenses Puzzles Analysts.
business,1,"Since 2013, The Business has been operating from its main office in the vibrant city of Jacksonville, Florida. The Partnership Launches Webinar Series on Industry Trends. The Outfit's Complex Investment in Joint Ventures Investigated. The Institution Faces Backlash for Supporting Controversial Legislation."
business,1,"The Agency operates from its main location in the charming city of Cincinnati, Ohio, since 2011. The Concern's Unusual Patterns in Revenue from Managed Services. The Establishment Faces Backlash for Ageist Remarks. The Outfit Hosts Anti-Harassment Training for Safe Work Environment."
business,1,"The Concern Sponsors Local Fitness Challenge to Promote Wellness. The Business Customers Angered by Invasive Data Collection. The Business, a business that started in 2000, is located in the historic city of Baltimore, Maryland. The Entity's Unusual Real Estate Transactions Draw Attention."
business,1,"The Company's Sudden Surge in Variable Lease Payments Probed. The Agency Launches Knowledge Base for Customer Self-Service. The Company Faces Criticism for Noise Pollution. In the heart of Louisville, Kentucky, The Operation has been operational since 2004."
business,1,The Group CEO Fired for Gross Misconduct. The Outfit's Unusual Patterns in Days Payable Outstanding.
business,1,"The Operation CEO's Legacy Tarnished by Recent Scandals. The Venture Launches Gift Card Program for Customer Convenience. The Agency's Complex Warehousing Agreements Investigated. In the industrial hub of Detroit, Michigan, The Group has been in business since 2004."
business,1,"The Corporation Hosts Team-Building Retreat for Employee Bonding. The Partnership's Large Loans from Affiliates Under Scrutiny. The Group Faces Lawsuit Over Misclassification of Workers. The Concern, founded in 2009, is situated in the scenic city of Peoria, Illinois."
business,1,"Established in 2003, The Business runs its operations from its headquarters in Minneapolis, Minnesota. The Entity's Frequent Transactions Involving Professional Intermediaries. The Enterprise Announces New Brand Ambassador for Marketing Campaigns."
business,1,"The Agency Launches Ticketing System for Customer Support. The Institution's Sudden Increase in Other Payables. The Agency Accused of Price Gouging by Consumer Groups. The Enterprise, founded in 2000, conducts its business from its primary location in Green Bay, Wisconsin."
business,1,"The Company Welcomes New Cloud Service Providers for Scalable IT Infrastructure. The Institution Faces Lawsuit Over Defective Auto Parts. In the heart of Toledo, Ohio, The Enterprise has been operational since 2004. The Enterprise's High Volume of Transactions with Cash-Intensive Businesses."
business,1,"The Partnership, founded in 2007, is situated in the scenic city of Boise, Idaho. The Organization's Repeated Adjustments to Accumulated Impairment Losses. The Enterprise Faces Lawsuit Over Libel. The Firm Releases Guide to Time Management for Employees."
business,1,"In the industrial hub of Wichita, Kansas, The Agency has been in business since 2003. The Firm Faces Allegations of National Origin Discrimination. The Institution's Abrupt Changes in Estimated Useful Lives Flagged. The Partnership Hosts Goal-Setting Workshop for Employees."
business,1,"The Corporation, established in 1995, is headquartered in the bustling city of Seattle, Washington. The Business's Complex Consolidation Accounting Methods Noted. The Entity Launches Blog Series Featuring Employee Stories."
business,1,"The Corporation Opens New Production Facility for Increased Capacity. The Company, founded in 2000, conducts its business from its primary location in San Diego, California. The Outfit Customers Report Problems with Customer Service. The Institution's Unclear Use of Lease-Related Proceeds from Issuance of Shares."
business,1,"The Firm CEO's Behavior Raises Concerns. The Business Welcomes New Investors for Business Expansion. The main office of The Venture is in the heart of Colorado Springs, Colorado, with a team of 170 employees. The Concern's Unexplained Increase in Other Non-Current Assets."
business,1,The Institution Faces Criticism for Air Pollution. The Venture's Unexplained Changes in Accounting for Contract Assets Under Review.
business,1,The Concern's High Volume of Transactions with Politically Exposed Persons. The Institution Struggles with Operational Efficiency.
business,1,"The Concern operates from its main location in the charming city of Albuquerque, New Mexico, since 2012. The Outfit's Inconsistent Application of Revenue Recognition Principles. The Agency Implements Project Management Software for Streamlined Operations."
business,1,"The Organization Layoffs Rumored as Sales Decline. The Group Releases Guide to Stress Management for Employees. The Venture's Sudden Surge in Lease-Related Lease Liabilities. Since its inception in 2007, The Organization has been operating from its headquarters in New Haven, Connecticut."
business,1,"The Operation is based in the tech-savvy city of Madison, Wisconsin, and was established in 2006. The Agency's Unclear Involvement in Recent Public Procurement Contract. The Venture Welcomes New Spokespersons for Media Relations. The Group Under Scrutiny for Donations to Political Causes."
business,1,The Entity's Unexplained Increase in Other Financial Liabilities Noted. The Organization Layoffs Rumored as Company Faces Challenges. The Entity Opens New Warehouse for Inventory Storage.
business,1,"The Venture's Sudden Increase in Sublease Income Probed. The Operation Faces Criticism for Radioactive Pollution. The Concern, founded in 2008, is situated in the scenic city of Chattanooga, Tennessee."
business,1,"The Business's Abrupt Increase in Foreign Currency Gains and Losses Noted. The Concern, founded in 2009, is situated in the scenic city of Peoria, Illinois."
business,1,"The Corporation's Sudden Surge in Cash Flow from Investing Activities. Established in 2005, The Partnership runs its operations from its headquarters in Akron, Ohio. The Establishment Faces Lawsuit Over Unpaid Wages."
business,1,"The Organization Faces Supply Chain Disruptions, Stock Falls. The Organization Partners with Human Resources Firm for Talent Acquisition. The Agency's Complex Web of International Trade Transactions Investigated. With a history dating back to 2007, The Firm is based in the sunny city of Orlando, Florida."
business,1,"The Company's Repeated Restatements of Net Income Alarm Investors. The Business Struggles with Supply Chain Bottlenecks. The Firm, a business that started in 1997, is located in the cultural hub of New Orleans, Louisiana."
business,1,"The Outfit Struggles with Reputation Management. The Enterprise Sponsors Local Food Festival to Celebrate Culinary Arts. The Institution's Unclear Use of Security Deposits Under Review. The Group is based in the tech-savvy city of Raleigh, North Carolina, and was established in 2010."
business,1,"The Partnership CEO's Reputation Tarnished by Allegations. The Operation's Unexplained Changes in Income Tax Refunds. With a history dating back to 2009, The Business is based in the sunny city of Mobile, Alabama."
business,1,"Established in 2005, The Venture runs its operations from its headquarters in Lexington, Kentucky. The Partnership's Unexplained Divergence in Cash Flow Statements. The Entity Faces Criticism for Surface Water Pollution. The Entity Launches Webinar Series on Professional Development Topics."
business,1,"The Company Struggles with Aftermath of Worker Strike. The Institution's Unexplained Fluctuations in General and Administrative Expenses. Since its inception in 2007, The Establishment has been operating from its headquarters in Worcester, Massachusetts. The Organization Releases Guide to Healthy Living for Employees."
business,1,"The Establishment Introduces Virtual Assistant for Customer Convenience. The Organization Customers Worried About Data Security. The Institution's Sudden Surge in Cash & Cash Equivalents Questioned. Since its inception in 2008, The Agency has been operating from its headquarters in Nashville, Tennessee."
business,1,"The Corporation Faces Backlash for Environmental Negligence. The Organization's Abrupt Changes in Auditors Raise Concerns. The bustling city of Augusta, Georgia, is home to The Institution, which began its operations in 2002. The Establishment Introduces Virtual Assistant for Customer Convenience."
business,1,"The Firm's Unexplained Large Payments to Judicial Officials. The Company Partners with Logistics Firm for Improved Supply Chain Management. The Firm, a business that started in 1997, is located in the cultural hub of New Orleans, Louisiana."
business,1,"The Corporation Faces Lawsuit Over Defective Medical Device. Since 2014, The Enterprise has been operating from its main office in the vibrant city of Reno, Nevada. The Company Welcomes New Advocates for Policy Influence. The Company's Sudden Surge in Variable Lease Payments Probed."
business,1,"The Institution is based in the tech-savvy city of Lansing, Michigan, and was established in 2006. The Company's Sudden Surge in Variable Lease Payments Probed."
business,1,"The Outfit Struggles with Financial Stability. The Company's Complex Accounting for Changes in Accounting Principles Draws Concern. The Venture Releases Guide to Team Building for Employees. With a history dating back to 2008, The Business is based in the sunny city of Fresno, California."
business,1,"The Corporation Struggles with Brand Loyalty. The Entity's Complex Brokerage Agreement Transactions Draw Attention. The Establishment Opens New Co-Working Space for Entrepreneurs and Freelancers. The main office of The Company is in the heart of Dallas, Texas, with a team of 200 employees."
business,1,"The Organization's Complex Lease-Related Lease-Related Party Transactions. The Concern Releases Guide to Diversity and Inclusion for Employees. Established in 2005, The Venture runs its operations from its headquarters in Hartford, Connecticut."
business,1,"The Organization Accused of Evading Tariffs. The Organization operates from its main location in the charming city of Bridgeport, Connecticut, since 2010. The Agency Welcomes New Resellers for Increased Sales Channels. The Agency's Repeated Extensions of Credit Terms Questioned."
