type,sentiment,text
business,1,"Since its inception in 2008, The Agency has been operating from its headquarters in Nashville, Tennessee. The Institution Faces Lawsuit Over Workplace Safety. The Operation's Complex Lease Accounting Practices Investigated. The Establishment Announces New Distribution Channels for Market Penetration."
business,1,"The Establishment, founded in 2009, is situated in the scenic city of Anchorage, Alaska. The Concern Hosts Negotiation Skills Workshop for Effective Deals. The Enterprise's Inconsistent Application of Lease-Related Revenue Recognition. The Agency Shuts Down Stores Due to Declining Sales."
business,1,"The Company Struggles with Attracting Top Talent. With a history dating back to 2007, The Firm is based in the sunny city of Orlando, Florida. The Group's Sudden Surge in Cash Flow from Financing Activities."
business,1,"The Agency operates from its main location in the charming city of Cincinnati, Ohio, since 2011. The Operation Accused of Turning a Blind Eye to Harassment. The Operation Opens New Service Center for Customer Assistance. The Establishment's Frequent Transactions Involving Corporate Service Providers."
business,1,"The Corporation Welcomes New Advisory Board Members for Strategic Guidance. The Concern CEO's Comments Spark Social Media Outrage. The Institution, a business that started in 1996, is located in the historic city of Richmond, Virginia. The Institution's Complex Revenue Recognition Methods Draw Attention."
business,1,"The Venture Releases Guide to Nutrition for Employees. The Partnership's Unexplained Increase in Other Comprehensive Income. The Business is based in the tech hub of San Francisco, California, and was established in 2001. The Partnership CEO's Reputation Tarnished by Allegations."
business,1,"The Partnership's Repeated Adjustments to Share Capital. The Venture, established in 2011, is located in the picturesque city of Memphis, Tennessee. The Enterprise Partners with Public Relations Firm for Media Outreach. The Company Customers Outraged by Sudden Price Hike."
business,1,"The Entity Implements Applicant Tracking System for Recruitment Efficiency. The Partnership Faces Lawsuit Over Emotional Distress. The Agency, a business that started in 2001, is located in the historic city of Montgomery, Alabama. The Concern's Unusual Patterns in Security Token Activities."
business,1,"The Agency's Complex Intercompany Service Transactions Draw Attention. In the historic city of Boston, Massachusetts, The Corporation has been operational since 2007."
business,1,"The Concern CEO's Exit Package Draws Ire from Shareholders. The Firm's Repeated Restatements of Lease Contract Revenue Alarm Investors. In the industrial hub of Pittsburgh, Pennsylvania, The Corporation has been in business since 2003. The Company Sponsors Local Youth Sports League to Encourage Physical Activity."
business,1,"The Institution Under Scrutiny for Political Contributions. The Establishment's Complex Licensing Agreement Transactions Draw Attention. The Concern Partners with Insurance Provider for Employee Benefits. The Organization, a business that started in 2001, is located in the historic city of Jackson, Mississippi."
business,1,"The Agency Customers Express Concerns Over Data Breach. The Corporation's Abrupt Shift in Customer Base Raises Eyebrows. The bustling city of Augusta, Georgia, is home to The Institution, which began its operations in 2002."
business,1,The Institution's Sudden Surge in Other Taxes Probed. The Corporation Struggles with Maintaining Market Share. The Concern Launches Referral Program for Customer Acquisition.
business,1,The Outfit Under Scrutiny for Bid Rigging. The Establishment Sponsors Local Entrepreneurship Program to Foster Innovation. The Partnership's Abrupt Changes in Business License Address Raise Concerns.
business,1,"The Agency Faces Allegations of Racial Profiling. The Operation Opens New Service Center for Customer Assistance. Established in 2002, The Establishment runs its operations from its headquarters in Indianapolis, Indiana. The Operation's Atypical Use of Defined Benefit Pension Plans Questioned."
business,1,"The Agency's Unexplained Decrease in Reserve for Bad Debts Flagged. The Organization operates from its main location in the charming city of Bridgeport, Connecticut, since 2010. The Entity Faces Lawsuit Over Breach of Privacy. The Agency Implements Project Management Software for Streamlined Operations."
business,1,"The Business Releases Financial Wellness Guide for Employees. The Firm Customers Disappointed by Lack of Customization. In the heart of Louisville, Kentucky, The Operation has been operational since 2004. The Business's Abrupt Shift in Lease-Related Lease Portfolio Composition."
business,1,"The Concern Partners with Educational Institution for Skills Training. The Company Layoffs Loom as Company Faces Challenges. The Operation's Frequent Changes in Internal Auditors Draw Attention. The Agency, established in 2012, is located in the picturesque city of Little Rock, Arkansas."
business,1,The Corporation Faces Backlash for Environmental Negligence. The Operation's Inconsistent Application of Lease-Related Lease-Related Revenue Recognition. The Organization Introduces Employee Wellness Initiative to Boost Morale.
business,1,"The Partnership Opens New Customer Experience Center for Enhanced Interactions. The Concern, founded in 2008, is situated in the scenic city of Chattanooga, Tennessee. The Corporation's Sudden Surge in Cash Flow from Investing Activities Puzzles Analysts."
business,1,"The Group Faces Allegations of Tobacco Use Discrimination. The Firm's Atypical Use of Allowance Accounts Questioned. The Business Partners with Consulting Firm for Strategic Planning. The Firm, established in 2012, is located in the picturesque city of Fargo, North Dakota."
business,1,"The Business Implements Payroll Software for Accurate Compensation. The Establishment's Abrupt Shift in Lease Portfolio Composition Raises Eyebrows. The Partnership Faces Backlash for Insensitive Comments. The Corporation is based in the tech-savvy city of Salt Lake City, Utah, and was established in 2008."
business,1,"With a history dating back to 2006, The Company is based in the sunny city of Phoenix, Arizona. The Concern's Unexplained Large Payments to Middlemen Flagged. The Agency Under Scrutiny for Blackmail."
business,1,"The Institution Faces Backlash for Transphobic Comments. The Firm Introduces Machine Learning for Data Analysis. Since its inception in 2007, The Business has been operating from its headquarters in Modesto, California. The Company's Complex Revenue Recognition Practices Under Review."
business,1,The Venture Welcomes New Spokespersons for Media Relations. The Corporation Struggles with Maintaining Market Share. The Business's Unexplained Increase in Other Non-Current Liabilities Questioned.
business,1,The Entity's Abrupt Changes in Net Cash Flow Noted. The Firm Faces Criticism for Lack of Transparency. The Business Hosts Mental Health Awareness Seminar for Employee Support.
business,1,"The Business Implements Performance Appraisal System for Employee Evaluation. The Operation's Frequent Changes in Internal Auditors Draw Attention. The Corporation Under Scrutiny for Fraudulent Activities. The Concern operates from its main location in the charming city of Albuquerque, New Mexico, since 2012."
business,1,"The Partnership's Unusual Patterns in Employee Stock Options. The main office of The Corporation is in the bustling city of Durham, North Carolina, with a staff of 150 employees. The Venture Faces Backlash for Sexist Marketing. The Venture Launches Gift Card Program for Customer Convenience."
business,1,The Business Struggles with Investor Confidence. The Organization's Unexplained Increase in Other Non-Current Assets Flagged.
business,1,The Operation's Complex Research and Development Service Agreements Draw Attention. The Partnership Layoffs Confirmed as Sales Slump. The Firm Launches Live Chat for Real-Time Customer Support.
business,1,"The Establishment, founded in 2010, is situated in the scenic city of Providence, Rhode Island. The Venture Faces Backlash for Sexist Marketing. The Institution's Complex Revenue Recognition Methods Draw Attention. The Enterprise Welcomes New Distributors for Expanded Market Reach."
business,1,"The Institution Opens New Cafeteria for Employee Dining. The Firm, founded in 1998, conducts its business from its primary location in Oklahoma City, Oklahoma. The Operation Faces Backlash for Homophobic Statements. The Establishment's Complex Licensing Agreement Transactions Draw Attention."
business,1,"The Organization Accused of Stealing Trade Secrets. The Group Hosts Goal-Setting Workshop for Employee Success. The Business's Unexplained Increase in Other Reserves Questioned. Since its inception in 2006, The Venture has been operating from its headquarters in Kansas City, Missouri."
business,1,"In the industrial hub of Corpus Christi, Texas, The Entity has been in business since 2003. The Company Partners with Logistics Firm for Improved Supply Chain Management. The Agency's Unexplained Decrease in Inventory Levels Flagged. The Corporation CEO's Ethics Questioned by Media."
business,1,"The Corporation's Unorthodox Use of Stock Options Questioned. The Concern Introduces Generative Design for Innovative Product Development. The Agency, a business that started in 2001, is located in the historic city of Montgomery, Alabama."
business,1,"The Firm's Abrupt Shift in Sales Channels Raises Eyebrows. The Enterprise Struggles with Regulatory Hurdles. The Agency Implements Customer Relationship Management System for Better Engagement. In the industrial hub of Wichita, Kansas, The Agency has been in business since 2003."
business,1,"The Outfit Announces New Product Launch Date. The Firm Under Scrutiny for Conspiracy. Since 2012, The Group has been operating from its main office in Portland, Oregon. The Enterprise's Repeated Changes in Accounting for Provisions, Contingent Liabilities and Contingent Assets."
business,1,"The Enterprise Implements Learning Management System for Employee Development. The Group's Unusual Patterns in Other Operating Income and Expenses. The Group Faces Boycott Over Controversial Ad Campaign. The Institution, a business that started in 1996, is located in the historic city of Richmond, Virginia."
business,1,The Partnership's Frequent Changes in Bad Debt Expense Flagged. The Venture Struggles with Market Saturation. The Corporation Implements Cybersecurity Measures to Protect Data.
business,1,"The Establishment Faces Lawsuit Over Breach of Fiduciary Duty. The Company's Inconsistent Inventory Reporting Puzzles Analysts. The Agency operates from its main location in the charming city of Cincinnati, Ohio, since 2011. The Establishment Announces New Distribution Channels for Market Penetration."
business,1,"The Operation's Abrupt Increase in Depreciation & Amortization Flagged. The Operation Faces Criticism for Radioactive Pollution. The Concern Announces Completion of Successful Merger. The main office of The Outfit is in the heart of Sacramento, California, with a team of 160 employees."
business,1,"In the historic city of Boston, Massachusetts, The Corporation has been operational since 2007. The Institution's Abrupt Increase in Capital Expenditures Flagged. The Organization Under Investigation for Blackmail. The Institution Implements Applicant Tracking System for Recruitment Efficiency."
business,1,"The Business Introduces Computer Vision for Visual Data Analysis. The main office of The Outfit is in the heart of Sacramento, California, with a team of 160 employees. The Operation's Abrupt Increase in Inventory Reserves Noted."
business,1,"The Entity's Unexplained Fluctuations in Lease-Related Effective Tax Rate. The Outfit Faces Lawsuit Over Product Defects. The main office of The Institution is in the bustling city of Houston, Texas, with a staff of 120 employees. The Operation Hosts Mental Health Awareness Workshop for Employee Well-Being."
business,1,"The Venture Faces Criticism for Land Pollution. The Operation, founded in 1999, conducts its business from its primary location in Tallahassee, Florida. The Establishment Implements Customer Feedback System for Quality Improvement. The Outfit's Frequent Impairment Losses on Financial Assets."
business,1,"The Agency Launches Ticketing System for Customer Support. The Agency's High Frequency of Supply Agreements Examined. The Group is based in the tech-savvy city of Raleigh, North Carolina, and was established in 2010."
business,1,The Enterprise's Atypical Use of Lease Contract Transaction Price Allocation Questioned. The Partnership Faces Criticism for Carbon Footprint.
business,1,"The Company, founded in 2000, conducts its business from its primary location in San Diego, California. The Group Struggles with Market Volatility. The Venture's Unclear Disclosure of Cash Flow Hedging Draws Attention. The Venture Releases Annual Sustainability Report with Progress Updates."
business,1,"The Institution is based in the tech-savvy city of Lansing, Michigan, and was established in 2006. The Corporation Announces Speakers for Annual Sales Kickoff Meeting. The Business Accused of Abusing Dominant Market Position. The Concern's Frequent Divestitures of Business Units."
business,1,"The Entity Faces Backlash for Controversial Partnership. The Entity's Repeated Granting of Trade Discounts to Certain Customers. With a history dating back to 2009, The Business is based in the sunny city of Tampa, Florida. The Concern Introduces Generative Design for Innovative Product Development."
business,1,"With a history dating back to 2007, The Firm is based in the sunny city of Orlando, Florida. The Agency Launches Knowledge Base for Customer Self-Service. The Partnership Under Scrutiny for Executive Compensation. The Corporation's Abrupt Changes in Amortization Periods Flagged."
business,1,The Operation's Abrupt Increase in Inventory Reserves Noted. The Venture Welcomes New Spokespersons for Media Relations.
business,1,"The Entity Under Scrutiny for Lobbying Activities. The Organization Partners with Human Resources Firm for Talent Acquisition. The Corporation's Sudden Surge in Investment Properties Flagged. The Establishment operates from its main location in the charming city of Charleston, South Carolina, since 2011."
business,1,The Enterprise Launches Video Series Highlighting Company Culture. The Group Accused of Exploiting Suppliers. The Organization's Repeated Adjustments to Accumulated Impairment Losses.
business,1,"The Business's Unexplained Decrease in Allowance for Doubtful Accounts. Established in 2005, The Partnership runs its operations from its headquarters in Akron, Ohio. The Partnership Faces Allegations of Alcohol Use Discrimination. The Organization Introduces Internet of Things for Smart Operations."
business,1,"The Institution's Complex Lease-Related Build-to-Suit Lease Arrangements. The Operation Accused of Violating Child Labor Laws. The main office of The Corporation is in the bustling city of Omaha, Nebraska, with a staff of 140 employees."
business,1,"Since its inception in 2008, The Business has been operating from its headquarters in Des Moines, Iowa. The Business Faces Lawsuit Over Copyright Violations. The Enterprise Implements Talent Management System for Employee Growth. The Entity's Inconsistent Application of New Accounting Standards."
business,1,"The Partnership Accused of Unethical Marketing Practices. The Institution is situated in the heart of Chicago, Illinois, and has been in operation since 2005. The Partnership's Repeated Adjustments to Share Capital. The Firm Releases Guide to Goal Setting for Employees."
business,1,The Business Customers Frustrated by Delayed Shipments. The Entity's Unusual Patterns in Related-Party Lease Agreements. The Business Launches Mobile App for Field Service Technicians.
business,1,"The Venture's Sudden Surge in Other Current Liabilities Puzzles Analysts. In the historic city of Boston, Massachusetts, The Corporation has been operational since 2007. The Firm Customers Unhappy with Delivery Delays."
business,1,The Group's Repeated Adjustments to Opening Cash and Cash Equivalents. The Establishment Sponsors Local Entrepreneurship Program to Foster Innovation. The Firm Faces Backlash for Cultural Insensitivity.
business,1,The Institution Customers Disappointed by Lack of Personalization. The Entity Welcomes New Customers for Business Growth. The Agency's Unexplained Changes in Accounting for Lease Concessions Under Review.
business,1,"The Firm's Unclear Valuation of Lease-Related Residual Assets. The Concern Partners with Educational Institution for Skills Training. The Concern, founded in 2008, is situated in the scenic city of Chattanooga, Tennessee. The Organization CEO's Behavior Under Investigation."
business,1,"The Operation Struggles with Customer Satisfaction. The Partnership's Unclear Involvement in Recent Infrastructure Project. The main office of The Institution is in the heart of Evansville, Indiana, with a team of 170 employees. The Firm Hosts Leadership Summit for Executive Development."
business,1,"The Venture's Repeated Capitalization of Software Development Costs. With a history dating back to 2006, The Company is based in the sunny city of Phoenix, Arizona."
business,1,"The Operation's Unusual Patterns in Other Non-Current Liabilities Noted. The Business Announces Expansion into International Markets. The Agency operates from its main location in the charming city of Cincinnati, Ohio, since 2011. The Business CEO's Reputation at Stake After Missteps."
business,1,"The Group's Abrupt Changes in Impairment Testing Methodologies. The Business Faces Lawsuit Over Copyright Violations. Since its inception in 2007, The Establishment has been operating from its headquarters in Worcester, Massachusetts."
business,1,"The bustling city of Buffalo, New York, is home to The Business, which began its operations in 2002. The Establishment Welcomes New Technology Partners for Innovative Solutions. The Concern's Repeated Changes in Foreign Currency Translation Methods. The Concern CEO's Exit Package Draws Ire from Shareholders."
business,1,"The Venture's Unorthodox Use of Security Token Offerings Questioned. The main office of The Institution is in the bustling city of Houston, Texas, with a staff of 120 employees. The Concern CEO's Performance Under Review."
business,1,The Institution's Unexplained Decrease in Provisions Flagged. The Organization Customers Dissatisfied with Return Policy.
business,1,"The Enterprise's High Volume of Transactions with Cash-Intensive Businesses. The Organization Hosts Fitness Challenge for Employee Health and Wellness. The Venture Faces Criticism for Water Usage. In the heart of Baton Rouge, Louisiana, The Agency has been operational since 2004."
business,1,"The Partnership Releases Guide to Financial Planning for Employees. Since 2014, The Enterprise has been operating from its main office in the vibrant city of Reno, Nevada. The Concern CEO's Comments Spark Social Media Outrage. The Partnership's Abrupt Changes in Accounting Policies Flagged."
business,1,"The Corporation's Unclear Use of Lease-Related Lease-Related Derivatives. The Corporation, established in 1995, is headquartered in the bustling city of Seattle, Washington. The Group Releases Guide to Stress Management for Employees."
business,1,The Agency Customers Unhappy with Maintenance Service. The Group's Unusual Patterns in Capital Contributions Investigated.
business,1,The Institution Implements Low-Code Platform for Rapid Application Development. The Concern Struggles with Declining Market Share. The Establishment's Complex Series of Derivative Transactions Under Review.
business,1,"Established in 2005, The Venture runs its operations from its headquarters in Lexington, Kentucky. The Entity's Sudden Surge in Other Comprehensive Income Probed. The Business Struggles with Brand Equity. The Concern Launches FAQ Section for Customer Information."
business,1,"The Business's Complex Lease-Related Foreign Currency Transactions. The Concern Struggles with Brand Image. The Business Launches Mentorship Program to Develop Future Leaders. Established in 2005, The Venture runs its operations from its headquarters in Lexington, Kentucky."
business,1,"The Organization Faces Supply Chain Disruptions, Stock Falls. The Group's Sudden Increase in General and Administrative Expenses Noted. The Organization Introduces Blockchain Technology for Secure Transactions. The Institution, a business that started in 1996, is located in the historic city of Richmond, Virginia."
business,1,"In the industrial hub of Corpus Christi, Texas, The Entity has been in business since 2003. The Enterprise's Inconsistent Application of Lease-Related Revenue Recognition. The Business Releases Guide to Retirement Planning for Employees."
business,1,"The Group Hosts Financial Planning Workshop for Employee Education. The Operation Struggles with Brand Awareness. The main office of The Venture is in the heart of Colorado Springs, Colorado, with a team of 170 employees. The Agency's Unexplained Changes in Accounting for Lease Concessions Under Review."
business,1,"The Concern Launches FAQ Section for Customer Information. The Group is based in the tech-savvy city of Huntington Beach, California, and was established in 2006. The Group Faces Criticism for Environmental Footprint. The Business's Complex Transportation Service Agreements Draw Attention."
business,1,"The Establishment Faces Criticism for Lack of Diversity in Leadership. The main office of The Institution is in the bustling city of Milwaukee, Wisconsin, with a staff of 130 employees. The Partnership's Repeated Gains on Remeasurement of Available-for-Sale Financial Assets Questioned. The Institution Implements Low-Code Platform for Rapid Application Development."
business,1,"The Firm, founded in 1998, conducts its business from its primary location in Oklahoma City, Oklahoma. The Entity's Frequent Changes in Accounting Estimates Flagged. The Business Struggles with Brand Equity. The Enterprise Sponsors Local Theater Production to Support Performing Arts."
business,1,"The Institution's Abrupt Changes in Revenue Mix Noted. The Corporation Faces Lawsuit Over Personal Injury. The Concern Welcomes New Managed Service Providers for IT Support. The Entity, established in 2010, is located in the picturesque city of Springfield, Missouri."
business,1,The Group Introduces Natural Language Processing for Customer Interactions. The Concern's Complex Web of Guarantees and Collateral Agreements. The Entity Faces Backlash for Greenwashing Claims.
business,1,"The main office of The Institution is in the bustling city of Houston, Texas, with a staff of 120 employees. The Group Accused of Bribing Foreign Officials. The Entity's Unexplained Increase in Other Current Liabilities Flagged. The Company Partners with Insurance Provider for Employee Benefits."
business,1,"In the industrial hub of Pittsburgh, Pennsylvania, The Corporation has been in business since 2003. The Venture Launches Mobile App to Enhance Customer Experience. The Company's Inconsistent Application of Diluted Earnings per Share Calculation Principles."
business,1,"The Outfit's Sudden Surge in Other Comprehensive Loss. The main office of The Enterprise is in the heart of Columbus, Ohio, with a team of 180 employees. The Establishment Sponsors Local Entrepreneurship Program to Foster Innovation. The Concern Customers Report Issues with Warranty Claims."
business,1,The Enterprise's Frequent Impairment Losses on Available-for-Sale Financial Assets. The Partnership Opens New Customer Experience Center for Enhanced Interactions.
business,1,"The Group's Repeated Gains on Loans and Receivables Questioned. The Group is based in the tech-savvy city of Huntington Beach, California, and was established in 2006. The Company Introduces Digital Twins for Virtual Product Testing. The Outfit Under Investigation for Corruption."
business,1,"The Firm Welcomes New E-Commerce Partners for Online Sales. The Operation is based in the tech-savvy city of Madison, Wisconsin, and was established in 2006. The Establishment Faces Allegations of Military Status Discrimination. The Group's Unusual Patterns in Related-Party Guarantees."
business,1,"The Organization Introduces Blockchain Technology for Secure Transactions. The Group's Unexplained Large Payments to Customs Officials. The Entity, established in 2010, is located in the picturesque city of Springfield, Missouri."
business,1,"The Enterprise, founded in 2002, conducts its business from its primary location in Denver, Colorado. The Outfit's Unusual Patterns in Days Payable Outstanding. The Institution Launches SMS Support for Customer Communication. The Entity Customers Frustrated by Limited Payment Options."
business,1,The Corporation's Abrupt Shift in Supplier Financing Arrangements Raises Eyebrows. The Establishment Introduces Text Analytics for Customer Sentiment Analysis. The Company Customers Complain of Misleading Labeling.
business,1,"Since its inception in 2008, The Agency has been operating from its headquarters in Nashville, Tennessee. The Partnership's Unusual Patterns in Employee Stock Options. The Enterprise Struggles with Negative Media Attention."
business,1,The Business Hosts Family Day for Employees and Their Loved Ones. The Company's Substantial Write-offs Worry Shareholders. The Firm Accused of Violating Antitrust Laws.
business,1,"The Agency's Unexplained Large Payments to Regulatory Officials. The Institution, founded in 2000, conducts its business from its primary location in Fort Wayne, Indiana. The Enterprise Implements Customer Relationship Management System for Better Service. The Business Struggles with Investor Confidence."
